
*** Running vivado
    with args -log design_1_wrapper.vds -m64 -product Vivado -mode batch -messageDb vivado.pb -notrace -source design_1_wrapper.tcl


****** Vivado v2019.1 (64-bit)
  **** SW Build 2552052 on Fri May 24 14:49:42 MDT 2019
  **** IP Build 2548770 on Fri May 24 18:01:18 MDT 2019
    ** Copyright 1986-2019 Xilinx, Inc. All Rights Reserved.

source design_1_wrapper.tcl -notrace
INFO: [IP_Flow 19-234] Refreshing IP repositories
INFO: [IP_Flow 19-1700] Loaded user IP repository 'h:/lab3-with-ip/lab3-vivado-HLS/solution1/impl/ip'.
INFO: [IP_Flow 19-2313] Loaded Vivado IP repository 'C:/Xilinx/Vivado/2019.1/data/ip'.
Command: synth_design -top design_1_wrapper -part xc7a100tcsg324-1
Starting synth_design
Attempting to get a license for feature 'Synthesis' and/or device 'xc7a100t'
INFO: [Common 17-349] Got license for feature 'Synthesis' and/or device 'xc7a100t'
INFO: [Device 21-403] Loading part xc7a100tcsg324-1
INFO: Launching helper process for spawning children vivado processes
INFO: Helper process launched with PID 10252 
---------------------------------------------------------------------------------
Starting RTL Elaboration : Time (s): cpu = 00:00:03 ; elapsed = 00:00:03 . Memory (MB): peak = 768.508 ; gain = 177.336
---------------------------------------------------------------------------------
INFO: [Synth 8-6157] synthesizing module 'design_1_wrapper' [H:/lab4/lab4-vivado/lab1.srcs/sources_1/bd/design_1/hdl/design_1_wrapper.v:12]
INFO: [Synth 8-6157] synthesizing module 'design_1' [H:/lab4/lab4-vivado/lab1.srcs/sources_1/bd/design_1/synth/design_1.v:13]
INFO: [Synth 8-6157] synthesizing module 'design_1_axi_gpio_0_0' [H:/lab4/lab4-vivado/lab1.runs/synth_1/.Xil/Vivado-9344-lab20/realtime/design_1_axi_gpio_0_0_stub.v:6]
INFO: [Synth 8-6155] done synthesizing module 'design_1_axi_gpio_0_0' (1#1) [H:/lab4/lab4-vivado/lab1.runs/synth_1/.Xil/Vivado-9344-lab20/realtime/design_1_axi_gpio_0_0_stub.v:6]
INFO: [Synth 8-6157] synthesizing module 'design_1_axi_uartlite_0_0' [H:/lab4/lab4-vivado/lab1.runs/synth_1/.Xil/Vivado-9344-lab20/realtime/design_1_axi_uartlite_0_0_stub.v:6]
INFO: [Synth 8-6155] done synthesizing module 'design_1_axi_uartlite_0_0' (2#1) [H:/lab4/lab4-vivado/lab1.runs/synth_1/.Xil/Vivado-9344-lab20/realtime/design_1_axi_uartlite_0_0_stub.v:6]
WARNING: [Synth 8-7023] instance 'axi_uartlite_0' of module 'design_1_axi_uartlite_0_0' has 22 connections declared, but only 21 given [H:/lab4/lab4-vivado/lab1.srcs/sources_1/bd/design_1/synth/design_1.v:157]
INFO: [Synth 8-6157] synthesizing module 'design_1_calc_0_0' [H:/lab4/lab4-vivado/lab1.runs/synth_1/.Xil/Vivado-9344-lab20/realtime/design_1_calc_0_0_stub.v:6]
INFO: [Synth 8-6155] done synthesizing module 'design_1_calc_0_0' (3#1) [H:/lab4/lab4-vivado/lab1.runs/synth_1/.Xil/Vivado-9344-lab20/realtime/design_1_calc_0_0_stub.v:6]
WARNING: [Synth 8-7023] instance 'calc_0' of module 'design_1_calc_0_0' has 20 connections declared, but only 19 given [H:/lab4/lab4-vivado/lab1.srcs/sources_1/bd/design_1/synth/design_1.v:179]
INFO: [Synth 8-6157] synthesizing module 'design_1_clk_wiz_1_0' [H:/lab4/lab4-vivado/lab1.runs/synth_1/.Xil/Vivado-9344-lab20/realtime/design_1_clk_wiz_1_0_stub.v:5]
INFO: [Synth 8-6155] done synthesizing module 'design_1_clk_wiz_1_0' (4#1) [H:/lab4/lab4-vivado/lab1.runs/synth_1/.Xil/Vivado-9344-lab20/realtime/design_1_clk_wiz_1_0_stub.v:5]
INFO: [Synth 8-6157] synthesizing module 'design_1_microblaze_0_0' [H:/lab4/lab4-vivado/lab1.runs/synth_1/.Xil/Vivado-9344-lab20/realtime/design_1_microblaze_0_0_stub.v:6]
INFO: [Synth 8-6155] done synthesizing module 'design_1_microblaze_0_0' (5#1) [H:/lab4/lab4-vivado/lab1.runs/synth_1/.Xil/Vivado-9344-lab20/realtime/design_1_microblaze_0_0_stub.v:6]
WARNING: [Synth 8-7023] instance 'microblaze_0' of module 'design_1_microblaze_0_0' has 43 connections declared, but only 42 given [H:/lab4/lab4-vivado/lab1.srcs/sources_1/bd/design_1/synth/design_1.v:206]
INFO: [Synth 8-6157] synthesizing module 'design_1_microblaze_0_axi_periph_0' [H:/lab4/lab4-vivado/lab1.srcs/sources_1/bd/design_1/synth/design_1.v:366]
INFO: [Synth 8-6157] synthesizing module 'm00_couplers_imp_8RVYHO' [H:/lab4/lab4-vivado/lab1.srcs/sources_1/bd/design_1/synth/design_1.v:944]
INFO: [Synth 8-6155] done synthesizing module 'm00_couplers_imp_8RVYHO' (6#1) [H:/lab4/lab4-vivado/lab1.srcs/sources_1/bd/design_1/synth/design_1.v:944]
INFO: [Synth 8-6157] synthesizing module 'm01_couplers_imp_1UTB3Y5' [H:/lab4/lab4-vivado/lab1.srcs/sources_1/bd/design_1/synth/design_1.v:1076]
INFO: [Synth 8-6155] done synthesizing module 'm01_couplers_imp_1UTB3Y5' (7#1) [H:/lab4/lab4-vivado/lab1.srcs/sources_1/bd/design_1/synth/design_1.v:1076]
INFO: [Synth 8-6157] synthesizing module 'm02_couplers_imp_7ANRHB' [H:/lab4/lab4-vivado/lab1.srcs/sources_1/bd/design_1/synth/design_1.v:1208]
INFO: [Synth 8-6155] done synthesizing module 'm02_couplers_imp_7ANRHB' (8#1) [H:/lab4/lab4-vivado/lab1.srcs/sources_1/bd/design_1/synth/design_1.v:1208]
INFO: [Synth 8-6157] synthesizing module 's00_couplers_imp_1RZP34U' [H:/lab4/lab4-vivado/lab1.srcs/sources_1/bd/design_1/synth/design_1.v:1574]
INFO: [Synth 8-6155] done synthesizing module 's00_couplers_imp_1RZP34U' (9#1) [H:/lab4/lab4-vivado/lab1.srcs/sources_1/bd/design_1/synth/design_1.v:1574]
INFO: [Synth 8-6157] synthesizing module 'design_1_xbar_0' [H:/lab4/lab4-vivado/lab1.runs/synth_1/.Xil/Vivado-9344-lab20/realtime/design_1_xbar_0_stub.v:6]
INFO: [Synth 8-6155] done synthesizing module 'design_1_xbar_0' (10#1) [H:/lab4/lab4-vivado/lab1.runs/synth_1/.Xil/Vivado-9344-lab20/realtime/design_1_xbar_0_stub.v:6]
WARNING: [Synth 8-7023] instance 'xbar' of module 'design_1_xbar_0' has 40 connections declared, but only 38 given [H:/lab4/lab4-vivado/lab1.srcs/sources_1/bd/design_1/synth/design_1.v:903]
INFO: [Synth 8-6155] done synthesizing module 'design_1_microblaze_0_axi_periph_0' (11#1) [H:/lab4/lab4-vivado/lab1.srcs/sources_1/bd/design_1/synth/design_1.v:366]
INFO: [Synth 8-6157] synthesizing module 'microblaze_0_local_memory_imp_1K0VQXK' [H:/lab4/lab4-vivado/lab1.srcs/sources_1/bd/design_1/synth/design_1.v:1340]
INFO: [Synth 8-6157] synthesizing module 'design_1_dlmb_bram_if_cntlr_0' [H:/lab4/lab4-vivado/lab1.runs/synth_1/.Xil/Vivado-9344-lab20/realtime/design_1_dlmb_bram_if_cntlr_0_stub.v:6]
INFO: [Synth 8-6155] done synthesizing module 'design_1_dlmb_bram_if_cntlr_0' (12#1) [H:/lab4/lab4-vivado/lab1.runs/synth_1/.Xil/Vivado-9344-lab20/realtime/design_1_dlmb_bram_if_cntlr_0_stub.v:6]
INFO: [Synth 8-6157] synthesizing module 'design_1_dlmb_v10_0' [H:/lab4/lab4-vivado/lab1.runs/synth_1/.Xil/Vivado-9344-lab20/realtime/design_1_dlmb_v10_0_stub.v:6]
INFO: [Synth 8-6155] done synthesizing module 'design_1_dlmb_v10_0' (13#1) [H:/lab4/lab4-vivado/lab1.runs/synth_1/.Xil/Vivado-9344-lab20/realtime/design_1_dlmb_v10_0_stub.v:6]
WARNING: [Synth 8-7023] instance 'dlmb_v10' of module 'design_1_dlmb_v10_0' has 25 connections declared, but only 24 given [H:/lab4/lab4-vivado/lab1.srcs/sources_1/bd/design_1/synth/design_1.v:1486]
INFO: [Synth 8-6157] synthesizing module 'design_1_ilmb_bram_if_cntlr_0' [H:/lab4/lab4-vivado/lab1.runs/synth_1/.Xil/Vivado-9344-lab20/realtime/design_1_ilmb_bram_if_cntlr_0_stub.v:6]
INFO: [Synth 8-6155] done synthesizing module 'design_1_ilmb_bram_if_cntlr_0' (14#1) [H:/lab4/lab4-vivado/lab1.runs/synth_1/.Xil/Vivado-9344-lab20/realtime/design_1_ilmb_bram_if_cntlr_0_stub.v:6]
INFO: [Synth 8-6157] synthesizing module 'design_1_ilmb_v10_0' [H:/lab4/lab4-vivado/lab1.runs/synth_1/.Xil/Vivado-9344-lab20/realtime/design_1_ilmb_v10_0_stub.v:6]
INFO: [Synth 8-6155] done synthesizing module 'design_1_ilmb_v10_0' (15#1) [H:/lab4/lab4-vivado/lab1.runs/synth_1/.Xil/Vivado-9344-lab20/realtime/design_1_ilmb_v10_0_stub.v:6]
WARNING: [Synth 8-7023] instance 'ilmb_v10' of module 'design_1_ilmb_v10_0' has 25 connections declared, but only 24 given [H:/lab4/lab4-vivado/lab1.srcs/sources_1/bd/design_1/synth/design_1.v:1532]
INFO: [Synth 8-6157] synthesizing module 'design_1_lmb_bram_0' [H:/lab4/lab4-vivado/lab1.runs/synth_1/.Xil/Vivado-9344-lab20/realtime/design_1_lmb_bram_0_stub.v:6]
INFO: [Synth 8-6155] done synthesizing module 'design_1_lmb_bram_0' (16#1) [H:/lab4/lab4-vivado/lab1.runs/synth_1/.Xil/Vivado-9344-lab20/realtime/design_1_lmb_bram_0_stub.v:6]
WARNING: [Synth 8-7023] instance 'lmb_bram' of module 'design_1_lmb_bram_0' has 16 connections declared, but only 14 given [H:/lab4/lab4-vivado/lab1.srcs/sources_1/bd/design_1/synth/design_1.v:1557]
INFO: [Synth 8-6155] done synthesizing module 'microblaze_0_local_memory_imp_1K0VQXK' (17#1) [H:/lab4/lab4-vivado/lab1.srcs/sources_1/bd/design_1/synth/design_1.v:1340]
INFO: [Synth 8-6157] synthesizing module 'design_1_reset_inv_0_0' [H:/lab4/lab4-vivado/lab1.runs/synth_1/.Xil/Vivado-9344-lab20/realtime/design_1_reset_inv_0_0_stub.v:6]
INFO: [Synth 8-6155] done synthesizing module 'design_1_reset_inv_0_0' (18#1) [H:/lab4/lab4-vivado/lab1.runs/synth_1/.Xil/Vivado-9344-lab20/realtime/design_1_reset_inv_0_0_stub.v:6]
INFO: [Synth 8-6157] synthesizing module 'design_1_rst_clk_wiz_1_100M_0' [H:/lab4/lab4-vivado/lab1.runs/synth_1/.Xil/Vivado-9344-lab20/realtime/design_1_rst_clk_wiz_1_100M_0_stub.v:6]
INFO: [Synth 8-6155] done synthesizing module 'design_1_rst_clk_wiz_1_100M_0' (19#1) [H:/lab4/lab4-vivado/lab1.runs/synth_1/.Xil/Vivado-9344-lab20/realtime/design_1_rst_clk_wiz_1_100M_0_stub.v:6]
WARNING: [Synth 8-7023] instance 'rst_clk_wiz_1_100M' of module 'design_1_rst_clk_wiz_1_100M_0' has 10 connections declared, but only 8 given [H:/lab4/lab4-vivado/lab1.srcs/sources_1/bd/design_1/synth/design_1.v:355]
INFO: [Synth 8-6155] done synthesizing module 'design_1' (20#1) [H:/lab4/lab4-vivado/lab1.srcs/sources_1/bd/design_1/synth/design_1.v:13]
INFO: [Synth 8-6155] done synthesizing module 'design_1_wrapper' (21#1) [H:/lab4/lab4-vivado/lab1.srcs/sources_1/bd/design_1/hdl/design_1_wrapper.v:12]
WARNING: [Synth 8-3331] design s00_couplers_imp_1RZP34U has unconnected port M_ACLK
WARNING: [Synth 8-3331] design s00_couplers_imp_1RZP34U has unconnected port M_ARESETN
WARNING: [Synth 8-3331] design s00_couplers_imp_1RZP34U has unconnected port S_ACLK
WARNING: [Synth 8-3331] design s00_couplers_imp_1RZP34U has unconnected port S_ARESETN
WARNING: [Synth 8-3331] design m02_couplers_imp_7ANRHB has unconnected port M_ACLK
WARNING: [Synth 8-3331] design m02_couplers_imp_7ANRHB has unconnected port M_ARESETN
WARNING: [Synth 8-3331] design m02_couplers_imp_7ANRHB has unconnected port S_ACLK
WARNING: [Synth 8-3331] design m02_couplers_imp_7ANRHB has unconnected port S_ARESETN
WARNING: [Synth 8-3331] design m01_couplers_imp_1UTB3Y5 has unconnected port M_ACLK
WARNING: [Synth 8-3331] design m01_couplers_imp_1UTB3Y5 has unconnected port M_ARESETN
WARNING: [Synth 8-3331] design m01_couplers_imp_1UTB3Y5 has unconnected port S_ACLK
WARNING: [Synth 8-3331] design m01_couplers_imp_1UTB3Y5 has unconnected port S_ARESETN
WARNING: [Synth 8-3331] design m00_couplers_imp_8RVYHO has unconnected port M_ACLK
WARNING: [Synth 8-3331] design m00_couplers_imp_8RVYHO has unconnected port M_ARESETN
WARNING: [Synth 8-3331] design m00_couplers_imp_8RVYHO has unconnected port S_ACLK
WARNING: [Synth 8-3331] design m00_couplers_imp_8RVYHO has unconnected port S_ARESETN
WARNING: [Synth 8-3331] design design_1_microblaze_0_axi_periph_0 has unconnected port M00_ACLK
WARNING: [Synth 8-3331] design design_1_microblaze_0_axi_periph_0 has unconnected port M00_ARESETN
WARNING: [Synth 8-3331] design design_1_microblaze_0_axi_periph_0 has unconnected port M01_ACLK
WARNING: [Synth 8-3331] design design_1_microblaze_0_axi_periph_0 has unconnected port M01_ARESETN
WARNING: [Synth 8-3331] design design_1_microblaze_0_axi_periph_0 has unconnected port M02_ACLK
WARNING: [Synth 8-3331] design design_1_microblaze_0_axi_periph_0 has unconnected port M02_ARESETN
WARNING: [Synth 8-3331] design design_1_microblaze_0_axi_periph_0 has unconnected port S00_ACLK
WARNING: [Synth 8-3331] design design_1_microblaze_0_axi_periph_0 has unconnected port S00_ARESETN
---------------------------------------------------------------------------------
Finished RTL Elaboration : Time (s): cpu = 00:00:04 ; elapsed = 00:00:05 . Memory (MB): peak = 835.867 ; gain = 244.695
---------------------------------------------------------------------------------

Report Check Netlist: 
+------+------------------+-------+---------+-------+------------------+
|      |Item              |Errors |Warnings |Status |Description       |
+------+------------------+-------+---------+-------+------------------+
|1     |multi_driven_nets |      0|        0|Passed |Multi driven nets |
+------+------------------+-------+---------+-------+------------------+
---------------------------------------------------------------------------------
Start Handling Custom Attributes
---------------------------------------------------------------------------------
---------------------------------------------------------------------------------
Finished Handling Custom Attributes : Time (s): cpu = 00:00:04 ; elapsed = 00:00:05 . Memory (MB): peak = 835.867 ; gain = 244.695
---------------------------------------------------------------------------------
---------------------------------------------------------------------------------
Finished RTL Optimization Phase 1 : Time (s): cpu = 00:00:04 ; elapsed = 00:00:05 . Memory (MB): peak = 835.867 ; gain = 244.695
---------------------------------------------------------------------------------
INFO: [Project 1-570] Preparing netlist for logic optimization

Processing XDC Constraints
Initializing timing engine
Parsing XDC File [h:/lab4/lab4-vivado/lab1.srcs/sources_1/bd/design_1/ip/design_1_microblaze_0_0/design_1_microblaze_0_0/design_1_microblaze_0_0_in_context.xdc] for cell 'design_1_i/microblaze_0'
Finished Parsing XDC File [h:/lab4/lab4-vivado/lab1.srcs/sources_1/bd/design_1/ip/design_1_microblaze_0_0/design_1_microblaze_0_0/design_1_microblaze_0_0_in_context.xdc] for cell 'design_1_i/microblaze_0'
Parsing XDC File [h:/lab4/lab4-vivado/lab1.srcs/sources_1/bd/design_1/ip/design_1_axi_uartlite_0_0/design_1_axi_uartlite_0_0/design_1_axi_uartlite_0_0_in_context.xdc] for cell 'design_1_i/axi_uartlite_0'
Finished Parsing XDC File [h:/lab4/lab4-vivado/lab1.srcs/sources_1/bd/design_1/ip/design_1_axi_uartlite_0_0/design_1_axi_uartlite_0_0/design_1_axi_uartlite_0_0_in_context.xdc] for cell 'design_1_i/axi_uartlite_0'
Parsing XDC File [h:/lab4/lab4-vivado/lab1.srcs/sources_1/bd/design_1/ip/design_1_axi_gpio_0_0/design_1_axi_gpio_0_0/design_1_axi_gpio_0_0_in_context.xdc] for cell 'design_1_i/axi_gpio_0'
Finished Parsing XDC File [h:/lab4/lab4-vivado/lab1.srcs/sources_1/bd/design_1/ip/design_1_axi_gpio_0_0/design_1_axi_gpio_0_0/design_1_axi_gpio_0_0_in_context.xdc] for cell 'design_1_i/axi_gpio_0'
Parsing XDC File [h:/lab4/lab4-vivado/lab1.srcs/sources_1/bd/design_1/ip/design_1_dlmb_v10_0/design_1_dlmb_v10_0/design_1_dlmb_v10_0_in_context.xdc] for cell 'design_1_i/microblaze_0_local_memory/dlmb_v10'
Finished Parsing XDC File [h:/lab4/lab4-vivado/lab1.srcs/sources_1/bd/design_1/ip/design_1_dlmb_v10_0/design_1_dlmb_v10_0/design_1_dlmb_v10_0_in_context.xdc] for cell 'design_1_i/microblaze_0_local_memory/dlmb_v10'
Parsing XDC File [h:/lab4/lab4-vivado/lab1.srcs/sources_1/bd/design_1/ip/design_1_ilmb_v10_0/design_1_ilmb_v10_0/design_1_dlmb_v10_0_in_context.xdc] for cell 'design_1_i/microblaze_0_local_memory/ilmb_v10'
Finished Parsing XDC File [h:/lab4/lab4-vivado/lab1.srcs/sources_1/bd/design_1/ip/design_1_ilmb_v10_0/design_1_ilmb_v10_0/design_1_dlmb_v10_0_in_context.xdc] for cell 'design_1_i/microblaze_0_local_memory/ilmb_v10'
Parsing XDC File [h:/lab4/lab4-vivado/lab1.srcs/sources_1/bd/design_1/ip/design_1_dlmb_bram_if_cntlr_0/design_1_dlmb_bram_if_cntlr_0/design_1_dlmb_bram_if_cntlr_0_in_context.xdc] for cell 'design_1_i/microblaze_0_local_memory/dlmb_bram_if_cntlr'
Finished Parsing XDC File [h:/lab4/lab4-vivado/lab1.srcs/sources_1/bd/design_1/ip/design_1_dlmb_bram_if_cntlr_0/design_1_dlmb_bram_if_cntlr_0/design_1_dlmb_bram_if_cntlr_0_in_context.xdc] for cell 'design_1_i/microblaze_0_local_memory/dlmb_bram_if_cntlr'
Parsing XDC File [h:/lab4/lab4-vivado/lab1.srcs/sources_1/bd/design_1/ip/design_1_ilmb_bram_if_cntlr_0/design_1_ilmb_bram_if_cntlr_0/design_1_ilmb_bram_if_cntlr_0_in_context.xdc] for cell 'design_1_i/microblaze_0_local_memory/ilmb_bram_if_cntlr'
Finished Parsing XDC File [h:/lab4/lab4-vivado/lab1.srcs/sources_1/bd/design_1/ip/design_1_ilmb_bram_if_cntlr_0/design_1_ilmb_bram_if_cntlr_0/design_1_ilmb_bram_if_cntlr_0_in_context.xdc] for cell 'design_1_i/microblaze_0_local_memory/ilmb_bram_if_cntlr'
Parsing XDC File [h:/lab4/lab4-vivado/lab1.srcs/sources_1/bd/design_1/ip/design_1_lmb_bram_0/design_1_lmb_bram_0/design_1_lmb_bram_0_in_context.xdc] for cell 'design_1_i/microblaze_0_local_memory/lmb_bram'
Finished Parsing XDC File [h:/lab4/lab4-vivado/lab1.srcs/sources_1/bd/design_1/ip/design_1_lmb_bram_0/design_1_lmb_bram_0/design_1_lmb_bram_0_in_context.xdc] for cell 'design_1_i/microblaze_0_local_memory/lmb_bram'
Parsing XDC File [h:/lab4/lab4-vivado/lab1.srcs/sources_1/bd/design_1/ip/design_1_clk_wiz_1_0/design_1_clk_wiz_1_0/design_1_clk_wiz_1_0_in_context.xdc] for cell 'design_1_i/clk_wiz_1'
Finished Parsing XDC File [h:/lab4/lab4-vivado/lab1.srcs/sources_1/bd/design_1/ip/design_1_clk_wiz_1_0/design_1_clk_wiz_1_0/design_1_clk_wiz_1_0_in_context.xdc] for cell 'design_1_i/clk_wiz_1'
Parsing XDC File [h:/lab4/lab4-vivado/lab1.srcs/sources_1/bd/design_1/ip/design_1_rst_clk_wiz_1_100M_0/design_1_rst_clk_wiz_1_100M_0/design_1_rst_clk_wiz_1_100M_0_in_context.xdc] for cell 'design_1_i/rst_clk_wiz_1_100M'
Finished Parsing XDC File [h:/lab4/lab4-vivado/lab1.srcs/sources_1/bd/design_1/ip/design_1_rst_clk_wiz_1_100M_0/design_1_rst_clk_wiz_1_100M_0/design_1_rst_clk_wiz_1_100M_0_in_context.xdc] for cell 'design_1_i/rst_clk_wiz_1_100M'
Parsing XDC File [h:/lab4/lab4-vivado/lab1.srcs/sources_1/bd/design_1/ip/design_1_xbar_0/design_1_xbar_0/design_1_xbar_0_in_context.xdc] for cell 'design_1_i/microblaze_0_axi_periph/xbar'
Finished Parsing XDC File [h:/lab4/lab4-vivado/lab1.srcs/sources_1/bd/design_1/ip/design_1_xbar_0/design_1_xbar_0/design_1_xbar_0_in_context.xdc] for cell 'design_1_i/microblaze_0_axi_periph/xbar'
Parsing XDC File [h:/lab4/lab4-vivado/lab1.srcs/sources_1/bd/design_1/ip/design_1_reset_inv_0_0/design_1_reset_inv_0_0/design_1_reset_inv_0_0_in_context.xdc] for cell 'design_1_i/reset_inv_0'
Finished Parsing XDC File [h:/lab4/lab4-vivado/lab1.srcs/sources_1/bd/design_1/ip/design_1_reset_inv_0_0/design_1_reset_inv_0_0/design_1_reset_inv_0_0_in_context.xdc] for cell 'design_1_i/reset_inv_0'
Parsing XDC File [h:/lab4/lab4-vivado/lab1.srcs/sources_1/bd/design_1/ip/design_1_calc_0_0_1/design_1_calc_0_0/design_1_calc_0_0_in_context.xdc] for cell 'design_1_i/calc_0'
Finished Parsing XDC File [h:/lab4/lab4-vivado/lab1.srcs/sources_1/bd/design_1/ip/design_1_calc_0_0_1/design_1_calc_0_0/design_1_calc_0_0_in_context.xdc] for cell 'design_1_i/calc_0'
Parsing XDC File [H:/lab4/lab4-vivado/lab1.srcs/constrs_1/new/file1.xdc]
WARNING: [Vivado 12-584] No ports matched 'SW[0]'. [H:/lab4/lab4-vivado/lab1.srcs/constrs_1/new/file1.xdc:2]
WARNING: [Vivado 12-584] No ports matched 'SW[1]'. [H:/lab4/lab4-vivado/lab1.srcs/constrs_1/new/file1.xdc:3]
WARNING: [Vivado 12-584] No ports matched 'SW[2]'. [H:/lab4/lab4-vivado/lab1.srcs/constrs_1/new/file1.xdc:4]
WARNING: [Vivado 12-584] No ports matched 'SW[3]'. [H:/lab4/lab4-vivado/lab1.srcs/constrs_1/new/file1.xdc:5]
WARNING: [Vivado 12-584] No ports matched 'SW[4]'. [H:/lab4/lab4-vivado/lab1.srcs/constrs_1/new/file1.xdc:6]
WARNING: [Vivado 12-584] No ports matched 'SW[5]'. [H:/lab4/lab4-vivado/lab1.srcs/constrs_1/new/file1.xdc:7]
WARNING: [Vivado 12-584] No ports matched 'SW[6]'. [H:/lab4/lab4-vivado/lab1.srcs/constrs_1/new/file1.xdc:8]
WARNING: [Vivado 12-584] No ports matched 'SW[7]'. [H:/lab4/lab4-vivado/lab1.srcs/constrs_1/new/file1.xdc:9]
WARNING: [Vivado 12-584] No ports matched 'SW[8]'. [H:/lab4/lab4-vivado/lab1.srcs/constrs_1/new/file1.xdc:10]
WARNING: [Vivado 12-584] No ports matched 'SW[9]'. [H:/lab4/lab4-vivado/lab1.srcs/constrs_1/new/file1.xdc:11]
WARNING: [Vivado 12-584] No ports matched 'SW[10]'. [H:/lab4/lab4-vivado/lab1.srcs/constrs_1/new/file1.xdc:12]
WARNING: [Vivado 12-584] No ports matched 'SW[11]'. [H:/lab4/lab4-vivado/lab1.srcs/constrs_1/new/file1.xdc:13]
WARNING: [Vivado 12-584] No ports matched 'SW[12]'. [H:/lab4/lab4-vivado/lab1.srcs/constrs_1/new/file1.xdc:14]
WARNING: [Vivado 12-584] No ports matched 'SW[13]'. [H:/lab4/lab4-vivado/lab1.srcs/constrs_1/new/file1.xdc:15]
WARNING: [Vivado 12-584] No ports matched 'SW[14]'. [H:/lab4/lab4-vivado/lab1.srcs/constrs_1/new/file1.xdc:16]
WARNING: [Vivado 12-584] No ports matched 'SW[15]'. [H:/lab4/lab4-vivado/lab1.srcs/constrs_1/new/file1.xdc:17]
Finished Parsing XDC File [H:/lab4/lab4-vivado/lab1.srcs/constrs_1/new/file1.xdc]
WARNING: [Project 1-498] One or more constraints failed evaluation while reading constraint file [H:/lab4/lab4-vivado/lab1.srcs/constrs_1/new/file1.xdc] and the design contains unresolved black boxes. These constraints will be read post-synthesis (as long as their source constraint file is marked as used_in_implementation) and should be applied correctly then. You should review the constraints listed in the file [.Xil/design_1_wrapper_propImpl.xdc] and check the run log file to verify that these constraints were correctly applied.
INFO: [Project 1-236] Implementation specific constraints were found while reading constraint file [H:/lab4/lab4-vivado/lab1.srcs/constrs_1/new/file1.xdc]. These constraints will be ignored for synthesis but will be used in implementation. Impacted constraints are listed in the file [.Xil/design_1_wrapper_propImpl.xdc].
Resolution: To avoid this warning, move constraints listed in [.Xil/design_1_wrapper_propImpl.xdc] to another XDC file and exclude this new file from synthesis with the used_in_synthesis property (File Properties dialog in GUI) and re-run elaboration/synthesis.
Parsing XDC File [H:/lab4/lab4-vivado/lab1.runs/synth_1/dont_touch.xdc]
Finished Parsing XDC File [H:/lab4/lab4-vivado/lab1.runs/synth_1/dont_touch.xdc]
Completed Processing XDC Constraints

Netlist sorting complete. Time (s): cpu = 00:00:00 ; elapsed = 00:00:00 . Memory (MB): peak = 930.566 ; gain = 0.000
INFO: [Project 1-111] Unisim Transformation Summary:
No Unisim elements were transformed.

Constraint Validation Runtime : Time (s): cpu = 00:00:00 ; elapsed = 00:00:00.013 . Memory (MB): peak = 930.566 ; gain = 0.000
WARNING: [Timing 38-316] Clock period '20.000' specified during out-of-context synthesis of instance 'design_1_i/microblaze_0_local_memory/lmb_bram' at clock pin 'clka' is different from the actual clock period '10.000', this can lead to different synthesis results.
---------------------------------------------------------------------------------
Finished Constraint Validation : Time (s): cpu = 00:00:09 ; elapsed = 00:00:11 . Memory (MB): peak = 932.531 ; gain = 341.359
---------------------------------------------------------------------------------
---------------------------------------------------------------------------------
Start Loading Part and Timing Information
---------------------------------------------------------------------------------
Loading part: xc7a100tcsg324-1
---------------------------------------------------------------------------------
Finished Loading Part and Timing Information : Time (s): cpu = 00:00:09 ; elapsed = 00:00:11 . Memory (MB): peak = 932.531 ; gain = 341.359
---------------------------------------------------------------------------------
---------------------------------------------------------------------------------
Start Applying 'set_property' XDC Constraints
---------------------------------------------------------------------------------
Applied set_property IO_BUFFER_TYPE = NONE for sys_clock. (constraint file  h:/lab4/lab4-vivado/lab1.srcs/sources_1/bd/design_1/ip/design_1_clk_wiz_1_0/design_1_clk_wiz_1_0/design_1_clk_wiz_1_0_in_context.xdc, line 3).
Applied set_property CLOCK_BUFFER_TYPE = NONE for sys_clock. (constraint file  h:/lab4/lab4-vivado/lab1.srcs/sources_1/bd/design_1/ip/design_1_clk_wiz_1_0/design_1_clk_wiz_1_0/design_1_clk_wiz_1_0_in_context.xdc, line 4).
Applied set_property DONT_TOUCH = true for design_1_i. (constraint file  auto generated constraint, line ).
Applied set_property DONT_TOUCH = true for design_1_i/microblaze_0. (constraint file  auto generated constraint, line ).
Applied set_property DONT_TOUCH = true for design_1_i/axi_uartlite_0. (constraint file  auto generated constraint, line ).
Applied set_property DONT_TOUCH = true for design_1_i/axi_gpio_0. (constraint file  auto generated constraint, line ).
Applied set_property DONT_TOUCH = true for design_1_i/microblaze_0_local_memory/dlmb_v10. (constraint file  auto generated constraint, line ).
Applied set_property DONT_TOUCH = true for design_1_i/microblaze_0_local_memory/ilmb_v10. (constraint file  auto generated constraint, line ).
Applied set_property DONT_TOUCH = true for design_1_i/microblaze_0_local_memory/dlmb_bram_if_cntlr. (constraint file  auto generated constraint, line ).
Applied set_property DONT_TOUCH = true for design_1_i/microblaze_0_local_memory/ilmb_bram_if_cntlr. (constraint file  auto generated constraint, line ).
Applied set_property DONT_TOUCH = true for design_1_i/microblaze_0_local_memory/lmb_bram. (constraint file  auto generated constraint, line ).
Applied set_property DONT_TOUCH = true for design_1_i/clk_wiz_1. (constraint file  auto generated constraint, line ).
Applied set_property DONT_TOUCH = true for design_1_i/rst_clk_wiz_1_100M. (constraint file  auto generated constraint, line ).
Applied set_property DONT_TOUCH = true for design_1_i/microblaze_0_axi_periph/xbar. (constraint file  auto generated constraint, line ).
Applied set_property DONT_TOUCH = true for design_1_i/microblaze_0_axi_periph. (constraint file  auto generated constraint, line ).
Applied set_property DONT_TOUCH = true for design_1_i/reset_inv_0. (constraint file  auto generated constraint, line ).
Applied set_property DONT_TOUCH = true for design_1_i/calc_0. (constraint file  auto generated constraint, line ).
---------------------------------------------------------------------------------
Finished applying 'set_property' XDC Constraints : Time (s): cpu = 00:00:09 ; elapsed = 00:00:11 . Memory (MB): peak = 932.531 ; gain = 341.359
---------------------------------------------------------------------------------
---------------------------------------------------------------------------------
Finished RTL Optimization Phase 2 : Time (s): cpu = 00:00:09 ; elapsed = 00:00:12 . Memory (MB): peak = 932.531 ; gain = 341.359
---------------------------------------------------------------------------------

Report RTL Partitions: 
+-+--------------+------------+----------+
| |RTL Partition |Replication |Instances |
+-+--------------+------------+----------+
+-+--------------+------------+----------+
---------------------------------------------------------------------------------
Start RTL Component Statistics 
---------------------------------------------------------------------------------
Detailed RTL Component Info : 
---------------------------------------------------------------------------------
Finished RTL Component Statistics 
---------------------------------------------------------------------------------
---------------------------------------------------------------------------------
Start RTL Hierarchical Component Statistics 
---------------------------------------------------------------------------------
Hierarchical RTL Component report 
---------------------------------------------------------------------------------
Finished RTL Hierarchical Component Statistics
---------------------------------------------------------------------------------
---------------------------------------------------------------------------------
Start Part Resource Summary
---------------------------------------------------------------------------------
Part Resources:
DSPs: 240 (col length:80)
BRAMs: 270 (col length: RAMB18 80 RAMB36 40)
---------------------------------------------------------------------------------
Finished Part Resource Summary
---------------------------------------------------------------------------------
---------------------------------------------------------------------------------
Start Cross Boundary and Area Optimization
---------------------------------------------------------------------------------
Warning: Parallel synthesis criteria is not met 
WARNING: [Synth 8-3331] design design_1_microblaze_0_axi_periph_0 has unconnected port M00_ACLK
WARNING: [Synth 8-3331] design design_1_microblaze_0_axi_periph_0 has unconnected port M00_ARESETN
WARNING: [Synth 8-3331] design design_1_microblaze_0_axi_periph_0 has unconnected port M01_ACLK
WARNING: [Synth 8-3331] design design_1_microblaze_0_axi_periph_0 has unconnected port M01_ARESETN
WARNING: [Synth 8-3331] design design_1_microblaze_0_axi_periph_0 has unconnected port M02_ACLK
WARNING: [Synth 8-3331] design design_1_microblaze_0_axi_periph_0 has unconnected port M02_ARESETN
WARNING: [Synth 8-3331] design design_1_microblaze_0_axi_periph_0 has unconnected port S00_ACLK
WARNING: [Synth 8-3331] design design_1_microblaze_0_axi_periph_0 has unconnected port S00_ARESETN
---------------------------------------------------------------------------------
Finished Cross Boundary and Area Optimization : Time (s): cpu = 00:00:10 ; elapsed = 00:00:14 . Memory (MB): peak = 932.531 ; gain = 341.359
---------------------------------------------------------------------------------

Report RTL Partitions: 
+-+--------------+------------+----------+
| |RTL Partition |Replication |Instances |
+-+--------------+------------+----------+
+-+--------------+------------+----------+
---------------------------------------------------------------------------------
Start Applying XDC Timing Constraints
---------------------------------------------------------------------------------
INFO: [Synth 8-5578] Moved timing constraint from pin 'design_1_i/microblaze_0_local_memory/dlmb_bram_if_cntlr/BRAM_Clk_A' to pin 'design_1_i/microblaze_0_local_memory/dlmb_bram_if_cntlr/bbstub_BRAM_Clk_A/O'
INFO: [Synth 8-5578] Moved timing constraint from pin 'design_1_i/microblaze_0_local_memory/ilmb_bram_if_cntlr/BRAM_Clk_A' to pin 'design_1_i/microblaze_0_local_memory/ilmb_bram_if_cntlr/bbstub_BRAM_Clk_A/O'
INFO: [Synth 8-5578] Moved timing constraint from pin 'design_1_i/clk_wiz_1/clk_out1' to pin 'design_1_i/clk_wiz_1/bbstub_clk_out1/O'
INFO: [Synth 8-5819] Moved 3 constraints on hierarchical pins to their respective driving/loading pins
---------------------------------------------------------------------------------
Finished Applying XDC Timing Constraints : Time (s): cpu = 00:00:17 ; elapsed = 00:00:20 . Memory (MB): peak = 932.531 ; gain = 341.359
---------------------------------------------------------------------------------
---------------------------------------------------------------------------------
Start Timing Optimization
---------------------------------------------------------------------------------
---------------------------------------------------------------------------------
Finished Timing Optimization : Time (s): cpu = 00:00:17 ; elapsed = 00:00:20 . Memory (MB): peak = 932.531 ; gain = 341.359
---------------------------------------------------------------------------------

Report RTL Partitions: 
+-+--------------+------------+----------+
| |RTL Partition |Replication |Instances |
+-+--------------+------------+----------+
+-+--------------+------------+----------+
---------------------------------------------------------------------------------
Start Technology Mapping
---------------------------------------------------------------------------------
---------------------------------------------------------------------------------
Finished Technology Mapping : Time (s): cpu = 00:00:17 ; elapsed = 00:00:20 . Memory (MB): peak = 932.531 ; gain = 341.359
---------------------------------------------------------------------------------

Report RTL Partitions: 
+-+--------------+------------+----------+
| |RTL Partition |Replication |Instances |
+-+--------------+------------+----------+
+-+--------------+------------+----------+
---------------------------------------------------------------------------------
Start IO Insertion
---------------------------------------------------------------------------------
---------------------------------------------------------------------------------
Start Flattening Before IO Insertion
---------------------------------------------------------------------------------
---------------------------------------------------------------------------------
Finished Flattening Before IO Insertion
---------------------------------------------------------------------------------
---------------------------------------------------------------------------------
Start Final Netlist Cleanup
---------------------------------------------------------------------------------
---------------------------------------------------------------------------------
Finished Final Netlist Cleanup
---------------------------------------------------------------------------------
---------------------------------------------------------------------------------
Finished IO Insertion : Time (s): cpu = 00:00:18 ; elapsed = 00:00:22 . Memory (MB): peak = 945.934 ; gain = 354.762
---------------------------------------------------------------------------------

Report Check Netlist: 
+------+------------------+-------+---------+-------+------------------+
|      |Item              |Errors |Warnings |Status |Description       |
+------+------------------+-------+---------+-------+------------------+
|1     |multi_driven_nets |      0|        0|Passed |Multi driven nets |
+------+------------------+-------+---------+-------+------------------+
---------------------------------------------------------------------------------
Start Renaming Generated Instances
---------------------------------------------------------------------------------
---------------------------------------------------------------------------------
Finished Renaming Generated Instances : Time (s): cpu = 00:00:18 ; elapsed = 00:00:22 . Memory (MB): peak = 945.934 ; gain = 354.762
---------------------------------------------------------------------------------

Report RTL Partitions: 
+-+--------------+------------+----------+
| |RTL Partition |Replication |Instances |
+-+--------------+------------+----------+
+-+--------------+------------+----------+
---------------------------------------------------------------------------------
Start Rebuilding User Hierarchy
---------------------------------------------------------------------------------
---------------------------------------------------------------------------------
Finished Rebuilding User Hierarchy : Time (s): cpu = 00:00:18 ; elapsed = 00:00:22 . Memory (MB): peak = 945.934 ; gain = 354.762
---------------------------------------------------------------------------------
---------------------------------------------------------------------------------
Start Renaming Generated Ports
---------------------------------------------------------------------------------
---------------------------------------------------------------------------------
Finished Renaming Generated Ports : Time (s): cpu = 00:00:18 ; elapsed = 00:00:22 . Memory (MB): peak = 945.934 ; gain = 354.762
---------------------------------------------------------------------------------
---------------------------------------------------------------------------------
Start Handling Custom Attributes
---------------------------------------------------------------------------------
---------------------------------------------------------------------------------
Finished Handling Custom Attributes : Time (s): cpu = 00:00:18 ; elapsed = 00:00:22 . Memory (MB): peak = 945.934 ; gain = 354.762
---------------------------------------------------------------------------------
---------------------------------------------------------------------------------
Start Renaming Generated Nets
---------------------------------------------------------------------------------
---------------------------------------------------------------------------------
Finished Renaming Generated Nets : Time (s): cpu = 00:00:18 ; elapsed = 00:00:22 . Memory (MB): peak = 945.934 ; gain = 354.762
---------------------------------------------------------------------------------
---------------------------------------------------------------------------------
Start Writing Synthesis Report
---------------------------------------------------------------------------------

Report BlackBoxes: 
+------+------------------------------+----------+
|      |BlackBox name                 |Instances |
+------+------------------------------+----------+
|1     |design_1_xbar_0               |         1|
|2     |design_1_axi_gpio_0_0         |         1|
|3     |design_1_axi_uartlite_0_0     |         1|
|4     |design_1_calc_0_0             |         1|
|5     |design_1_clk_wiz_1_0          |         1|
|6     |design_1_microblaze_0_0       |         1|
|7     |design_1_reset_inv_0_0        |         1|
|8     |design_1_rst_clk_wiz_1_100M_0 |         1|
|9     |design_1_dlmb_bram_if_cntlr_0 |         1|
|10    |design_1_dlmb_v10_0           |         1|
|11    |design_1_ilmb_bram_if_cntlr_0 |         1|
|12    |design_1_ilmb_v10_0           |         1|
|13    |design_1_lmb_bram_0           |         1|
+------+------------------------------+----------+

Report Cell Usage: 
+------+------------------------------+------+
|      |Cell                          |Count |
+------+------------------------------+------+
|1     |design_1_axi_gpio_0_0         |     1|
|2     |design_1_axi_uartlite_0_0     |     1|
|3     |design_1_calc_0_0             |     1|
|4     |design_1_clk_wiz_1_0          |     1|
|5     |design_1_dlmb_bram_if_cntlr_0 |     1|
|6     |design_1_dlmb_v10_0           |     1|
|7     |design_1_ilmb_bram_if_cntlr_0 |     1|
|8     |design_1_ilmb_v10_0           |     1|
|9     |design_1_lmb_bram_0           |     1|
|10    |design_1_microblaze_0_0       |     1|
|11    |design_1_reset_inv_0_0        |     1|
|12    |design_1_rst_clk_wiz_1_100M_0 |     1|
|13    |design_1_xbar_0               |     1|
|14    |IBUF                          |    18|
|15    |OBUF                          |    17|
+------+------------------------------+------+

Report Instance Areas: 
+------+------------------------------+--------------------------------------+------+
|      |Instance                      |Module                                |Cells |
+------+------------------------------+--------------------------------------+------+
|1     |top                           |                                      |  1273|
|2     |  design_1_i                  |design_1                              |  1238|
|3     |    microblaze_0_axi_periph   |design_1_microblaze_0_axi_periph_0    |   374|
|4     |    microblaze_0_local_memory |microblaze_0_local_memory_imp_1K0VQXK |   496|
+------+------------------------------+--------------------------------------+------+
---------------------------------------------------------------------------------
Finished Writing Synthesis Report : Time (s): cpu = 00:00:18 ; elapsed = 00:00:22 . Memory (MB): peak = 945.934 ; gain = 354.762
---------------------------------------------------------------------------------
Synthesis finished with 0 errors, 0 critical warnings and 8 warnings.
Synthesis Optimization Runtime : Time (s): cpu = 00:00:12 ; elapsed = 00:00:19 . Memory (MB): peak = 945.934 ; gain = 258.098
Synthesis Optimization Complete : Time (s): cpu = 00:00:18 ; elapsed = 00:00:22 . Memory (MB): peak = 945.934 ; gain = 354.762
INFO: [Project 1-571] Translating synthesized netlist
INFO: [Project 1-570] Preparing netlist for logic optimization
INFO: [Opt 31-138] Pushed 0 inverter(s) to 0 load pin(s).
Netlist sorting complete. Time (s): cpu = 00:00:00 ; elapsed = 00:00:00 . Memory (MB): peak = 973.988 ; gain = 0.000
INFO: [Project 1-111] Unisim Transformation Summary:
No Unisim elements were transformed.

INFO: [Common 17-83] Releasing license: Synthesis
59 Infos, 58 Warnings, 0 Critical Warnings and 0 Errors encountered.
synth_design completed successfully
synth_design: Time (s): cpu = 00:00:23 ; elapsed = 00:00:29 . Memory (MB): peak = 973.988 ; gain = 654.805
Netlist sorting complete. Time (s): cpu = 00:00:00 ; elapsed = 00:00:00 . Memory (MB): peak = 973.988 ; gain = 0.000
WARNING: [Constraints 18-5210] No constraints selected for write.
Resolution: This message can indicate that there are no constraints for the design, or it can indicate that the used_in flags are set such that the constraints are ignored. This later case is used when running synth_design to not write synthesis constraints to the resulting checkpoint. Instead, project constraints are read when the synthesized design is opened.
INFO: [Common 17-1381] The checkpoint 'H:/lab4/lab4-vivado/lab1.runs/synth_1/design_1_wrapper.dcp' has been generated.
INFO: [runtcl-4] Executing : report_utilization -file design_1_wrapper_utilization_synth.rpt -pb design_1_wrapper_utilization_synth.pb
INFO: [Common 17-206] Exiting Vivado at Thu Nov 27 16:51:30 2025...
